{
  "screenId": "cars24_home",
  "schemaVersion": "1.0",
  "minAppVersion": 1,
  "state": {
    "selected_category": "hatchback",
    "tenure_months": 24,
    "location": "Delhi"
  },
  "sections": [
    {
      "id": "search_header",
      "type": "search_header",
      "minAppVersion": 1,
      "props": { "placeholder": "Search by brand, model or budget", "location": "Delhi" },
      "actions": { 
        "onTap": { "type": "open_sheet", "sheetId": "search_sheet" },
        "onLocationTap": { "type": "open_sheet", "sheetId": "city_selector_sheet" },
        "onMenuTap": { "type": "open_sheet", "sheetId": "side_menu" }
      }
    },
    {
      "id": "hero_banner_carousel",
      "type": "carousel",
      "minAppVersion": 1,
      "props": {
        "autoScrollMs": 4000,
        "items": [
          {
            "imageUrl": "https://lh3.googleusercontent.com/aida-public/AB6AXuC3Be6njH2Mp-7_rjingXEYQUGofpqTvQrst7xanUJKb2DAD5B-WioAK0nTgbwavSM3EjAH8gDaLwIgT_F0AARdIBJRo2yLUwhL8dNu8bov2-nnrPCWIxZ0ZC1gG60ic2Yy2UnPr3xNjNy13rLmWQdv515vBlamtMp0tQCm6NOgVBU4bVzwdwI0LphtRNnVjl0vmTvwJe6wQnDnfciBwACsjdZS4L3jUaVFA_RWAnp1LVyS4sX9ObWLbg",
            "title": "Exchange Bonus",
            "subtitle": "Get up to ₹50,000 extra value",
            "actions": { "onTap": { "type": "navigate", "target": "offer_details", "params": { "offerId": "XYZ" } } }
          },
          {
            "imageUrl": "https://lh3.googleusercontent.com/aida-public/AB6AXuAd2_FvObtq6L_CoT4pwP8TC9bZBlKhpiMLzVrMIdza7zBz1ujh4gGJGBgtc8tQgdCEynVnnn1N3JIQApXyBORqC_KM9CUacmr_NuzsF1Y3QRUcFfd0NGTk0jUSRhLdXAcJ4HiKEQwnrcCZVJhqDvJn-7qO9mCCSIUedYjnbS9RV8q781geTK3h-FZqcJ0-VM6OAeUSDGWItCoIGs-6QlSDsWntg_gvEyEG8YZkNgWmA87BMTv2YKFDjQ",
            "title": "Zero Downpayment",
            "subtitle": "Drive home today with instant approvals",
            "actions": { "onTap": { "type": "navigate", "target": "loan_details" } }
          },
          {
            "imageUrl": "https://lh3.googleusercontent.com/aida-public/AB6AXuAnQ3vjz6AjCgstDroHpWA16V6tvyCjkjn9IgOROkOtny8E-DNGe-9dB4dZi18Jqs7ZV-MiulGDZR6bgRIFv_raoWCoy8aapPs-qvT9eDMdkA4sli2VmmXpzri7wK00CQKgE3jdFBBz-HbF7Ux0x68UhzpebpZLKt3UyJ7nfsB8wbRRfFZEEu90iCsBm_VyWaKxQXXyyQp5t0MpizNqJDyXXYeR99wVHuECTDoDF6FLLSQ3Gqa7EQePpg",
            "title": "Free Warranty",
            "subtitle": "1 Year comprehensive coverage",
            "actions": { "onTap": { "type": "navigate", "target": "warranty_details" } }
          }
        ]
      }
    },
    {
      "id": "category_chips",
      "type": "chip_group",
      "minAppVersion": 1,
      "props": {
        "selectedId": "hatchback",
        "options": [ { "id": "hatchback", "label": "Hatchback" }, { "id": "suv", "label": "SUV" }, { "id": "sedan", "label": "Sedan" } ]
      },
      "actions": {
        "onSelect": { "type": "update_state", "stateKey": "selected_category", "then": { "type": "refetch_section", "sectionId": "car_rail" } }
      }
    },
    {
      "id": "car_rail",
      "type": "horizontal_rail",
      "minAppVersion": 1,
      "props": {
        "title": "Recommended for you",
        "itemType": "car_card",
        "items": [
          { "carId": "swift-2021", "title": "2021 Maruti Swift", "price": "₹6.45L", "km": "15,000 km", "imageUrl": "https://lh3.googleusercontent.com/aida-public/AB6AXuD5OB2Ngr4nztYzyHD3ULJfBnyFXwAWGteRupgorZGqBZLubcsWnknHrBZWv-Lma1-osmfQwJYk5HQCKJ_I6XecOjVwG8nBef4RO4CT9P2rzCqNiiulbFGwtJJhgcaBykvSJvNKC6IyR6bmOA9VczVzbQu6Gf-6HrEGBLEbAHVX5xWQOFkPN1gJu-hWkGNWyHeZat8iuc5F4OgJA2ROJnxffErWJz3mkbrmntE45cf3_lTivsW6ur27Hw" },
          { "carId": "creta-2020", "title": "2020 Hyundai Creta", "price": "₹12.8L", "km": "32,000 km", "imageUrl": "https://lh3.googleusercontent.com/aida-public/AB6AXuAHPcOUnkBx_4feZ37LbsoRkl36Pf-Jayac86JLpQ3e1-xxQLLwMdLVKfnMDeZLHsPn3FNWd8XFPQZXbCYuVQ7MhSXYw0HNTeJ6NX4On_A3xvMfVBZ1-TCfjph-qDdt_SIL8REGKvKMZxAPwRAfsVp5T53iXUS0O956NsdTdReBGhlOc0M7KAMXHwgYC1-EdqefiTTonj6ae-5bHUYuBh3ULD9GqoOTiVj5a5_wFn1TOIIAMSQ-yKeD9g" }
        ]
      },
      "actions": { "onItemTap": { "type": "navigate", "target": "car_details", "paramsFromItem": ["carId"] } }
    },
    {
      "id": "emi_calculator",
      "type": "tenure_selector",
      "minAppVersion": 1,
      "props": { "options": [12, 24, 36, 48], "selectedBind": "state.tenure_months", "displayBind": "computed.emi" },
      "actions": { "onSelect": { "type": "update_state", "stateKey": "tenure_months", "recompute": ["emi"] } },
      "computed": { "emi": { "formula": "principal_rate_tenure_amortization", "inputs": ["principal", "rate", "state.tenure_months"] } }
    },
    {
      "id": "value_prop_strip",
      "type": "icon_text_row",
      "minAppVersion": 1,
      "props": { "items": [ { "icon": "shield", "label": "140 point inspection" }, { "icon": "refresh", "label": "5 day money back" } ] }
    },
    {
      "id": "footer_cta",
      "type": "cta_banner",
      "minAppVersion": 1,
      "props": { "title": "Sell your car", "ctaLabel": "Get Price" },
      "actions": { "onTap": { "type": "open_sheet", "sheetId": "sell_car_sheet" } }
    }
  ],
  "fallback": { "unknownComponent": { "render": "skip_with_log" } }
}
